{
  "width" : 12,
  "height" : 10,
  "playableArea" : {
    "width" : 4,
    "height" : 6,
    "x" : 0,
    "y" : 4
  },
  "cells" : {
    "mover" : [ {
      "orientation" : "right",
      "x" : 0,
      "y" : 5
    }, {
      "orientation" : "right",
      "x" : 1,
      "y" : 7
    } ],
    "generator" : [ {
      "orientation" : "top",
      "x" : 1,
      "y" : 5
    } ],
    "rotator" : [ {
      "rotation" : "clockwise",
      "x" : 2,
      "y" : 5
    }, {
      "rotation" : "clockwise",
      "x" : 6,
      "y" : 8
    }, {
      "rotation" : "clockwise",
      "x" : 11,
      "y" : 8
    }, {
      "rotation" : "clockwise",
      "x" : 11,
      "y" : 5
    } ],
    "block" : [ ],
    "enemy" : [ {
      "x" : 7,
      "y" : 2
    }, {
      "x" : 7,
      "y" : 5
    }, {
      "x" : 4,
      "y" : 5
    }, {
      "x" : 7,
      "y" : 4
    }, {
      "x" : 7,
      "y" : 1
    }, {
      "x" : 6,
      "y" : 5
    }, {
      "x" : 7,
      "y" : 3
    }, {
      "x" : 5,
      "y" : 5
    } ],
    "wall" : [ {
      "x" : 3,
      "y" : 3
    }, {
      "x" : 0,
      "y" : 3
    }, {
      "x" : 5,
      "y" : 0
    }, {
      "x" : 4,
      "y" : 3
    }, {
      "x" : 11,
      "y" : 3
    }, {
      "x" : 9,
      "y" : 3
    }, {
      "x" : 9,
      "y" : 2
    }, {
      "x" : 10,
      "y" : 3
    }, {
      "x" : 2,
      "y" : 3
    }, {
      "x" : 5,
      "y" : 1
    }, {
      "x" : 5,
      "y" : 2
    }, {
      "x" : 1,
      "y" : 3
    }, {
      "x" : 8,
      "y" : 8
    }, {
      "x" : 5,
      "y" : 3
    }, {
      "x" : 9,
      "y" : 1
    }, {
      "x" : 9,
      "y" : 0
    } ]
  }
}