{
  "width": 12,
  "height": 11,
  "playableArea": {
    "width": 5,
    "height": 6,
    "x": 0,
    "y": 0
  },
  "cells": {
    "mover": [
      {
        "orientation": "right",
        "x": 1,
        "y": 3
      },
      {
        "orientation": "down",
        "x": 4,
        "y": 3
      },
      {
        "orientation": "down",
        "x": 2,
        "y": 4
      }
    ],
    "block": [
      {
        "push": "vertical",
        "x": 0,
        "y": 1
      },
      {
        "push": "both",
        "x": 1,
        "y": 2
      },
      {
        "push": "both",
        "x": 2,
        "y": 2
      }
    ],
    "enemy": [
      {
        "x": 10,
        "y": 9
      }
    ],
    "wall": [
      {
        "x": 5,
        "y": 0
      },
      {
        "x": 6,
        "y": 0
      },
      {
        "x": 7,
        "y": 0
      },
      {
        "x": 8,
        "y": 0
      },
      {
        "x": 9,
        "y": 0
      },
      {
        "x": 10,
        "y": 0
      },
      {
        "x": 11,
        "y": 0
      },
      {
        "x": 5,
        "y": 1
      },
      {
        "x": 6,
        "y": 1
      },
      {
        "x": 7,
        "y": 1
      },
      {
        "x": 8,
        "y": 1
      },
      {
        "x": 9,
        "y": 1
      },
      {
        "x": 10,
        "y": 1
      },
      {
        "x": 11,
        "y": 1
      },
      {
        "x": 5,
        "y": 2
      },
      {
        "x": 6,
        "y": 2
      },
      {
        "x": 7,
        "y": 2
      },
      {
        "x": 8,
        "y": 2
      },
      {
        "x": 9,
        "y": 2
      },
      {
        "x": 10,
        "y": 2
      },
      {
        "x": 11,
        "y": 2
      },
      {
        "x": 5,
        "y": 3
      },
      {
        "x": 6,
        "y": 3
      },
      {
        "x": 7,
        "y": 3
      },
      {
        "x": 8,
        "y": 3
      },
      {
        "x": 9,
        "y": 3
      },
      {
        "x": 10,
        "y": 3
      },
      {
        "x": 11,
        "y": 3
      },
      {
        "x": 5,
        "y": 4
      },
      {
        "x": 6,
        "y": 4
      },
      {
        "x": 7,
        "y": 4
      },
      {
        "x": 8,
        "y": 4
      },
      {
        "x": 9,
        "y": 4
      },
      {
        "x": 10,
        "y": 4
      },
      {
        "x": 11,
        "y": 4
      },
      {
        "x": 5,
        "y": 5
      },
      {
        "x": 6,
        "y": 5
      },
      {
        "x": 7,
        "y": 5
      },
      {
        "x": 8,
        "y": 5
      },
      {
        "x": 9,
        "y": 5
      },
      {
        "x": 10,
        "y": 5
      },
      {
        "x": 11,
        "y": 5
      },
      {
        "x": 5,
        "y": 6
      },
      {
        "x": 6,
        "y": 6
      },
      {
        "x": 7,
        "y": 6
      },
      {
        "x": 8,
        "y": 6
      },
      {
        "x": 9,
        "y": 6
      },
      {
        "x": 10,
        "y": 6
      },
      {
        "x": 11,
        "y": 6
      }
    ]
  }
}