{
  "width" : 17,
  "height" : 7,
  "playableArea" : {
    "width" : 5,
    "height" : 5,
    "x" : 1,
    "y" : 1
  },
  "cells" : {
    "mover" : [ {
      "x" : 2,
      "y" : 4,
      "orientation" : "right"
    }, {
      "x" : 1,
      "y" : 4,
      "orientation" : "right"
    }, {
      "x" : 1,
      "y" : 1,
      "orientation" : "top"
    } ],
    "deleter" : [ {
      "x" : 7,
      "y" : 0
    }, {
      "x" : 9,
      "y" : 0
    }, {
      "x" : 9,
      "y" : 6
    }, {
      "x" : 7,
      "y" : 6
    } ],
    "block" : [ {
      "x" : 9,
      "y" : 2,
      "push" : "vertical"
    }, {
      "x" : 7,
      "y" : 2,
      "push" : "vertical"
    }, {
      "x" : 9,
      "y" : 5,
      "push" : "vertical"
    }, {
      "x" : 7,
      "y" : 3,
      "push" : "vertical"
    }, {
      "x" : 9,
      "y" : 3,
      "push" : "vertical"
    }, {
      "x" : 7,
      "y" : 5,
      "push" : "vertical"
    }, {
      "x" : 4,
      "y" : 5,
      "push" : "both"
    }, {
      "x" : 7,
      "y" : 4,
      "push" : "vertical"
    }, {
      "x" : 9,
      "y" : 1,
      "push" : "vertical"
    }, {
      "x" : 7,
      "y" : 1,
      "push" : "vertical"
    }, {
      "x" : 9,
      "y" : 4,
      "push" : "vertical"
    }, {
      "x" : 5,
      "y" : 5,
      "push" : "both"
    } ],
    "rotator" : [ {
      "x" : 3,
      "y" : 1,
      "rotation" : "counterclockwise"
    }, {
      "x" : 5,
      "y" : 1,
      "rotation" : "clockwise"
    }, {
      "x" : 4,
      "y" : 1,
      "rotation" : "clockwise"
    } ],
    "enemy" : [ {
      "x" : 12,
      "y" : 3
    }, {
      "x" : 14,
      "y" : 3
    }, {
      "x" : 13,
      "y" : 3
    }, {
      "x" : 11,
      "y" : 3
    } ],
    "wall" : [ {
      "x" : 16,
      "y" : 3
    }, {
      "x" : 4,
      "y" : 0
    }, {
      "x" : 1,
      "y" : 0
    }, {
      "x" : 6,
      "y" : 0
    }, {
      "x" : 2,
      "y" : 6
    }, {
      "x" : 8,
      "y" : 6
    }, {
      "x" : 0,
      "y" : 3
    }, {
      "x" : 0,
      "y" : 2
    }, {
      "x" : 0,
      "y" : 5
    }, {
      "x" : 15,
      "y" : 0
    }, {
      "x" : 16,
      "y" : 0
    }, {
      "x" : 5,
      "y" : 0
    }, {
      "x" : 16,
      "y" : 1
    }, {
      "x" : 2,
      "y" : 0
    }, {
      "x" : 12,
      "y" : 0
    }, {
      "x" : 15,
      "y" : 6
    }, {
      "x" : 4,
      "y" : 6
    }, {
      "x" : 0,
      "y" : 4
    }, {
      "x" : 10,
      "y" : 6
    }, {
      "x" : 0,
      "y" : 6
    }, {
      "x" : 0,
      "y" : 1
    }, {
      "x" : 16,
      "y" : 4
    }, {
      "x" : 11,
      "y" : 6
    }, {
      "x" : 13,
      "y" : 0
    }, {
      "x" : 13,
      "y" : 6
    }, {
      "x" : 3,
      "y" : 6
    }, {
      "x" : 5,
      "y" : 6
    }, {
      "x" : 16,
      "y" : 2
    }, {
      "x" : 12,
      "y" : 6
    }, {
      "x" : 16,
      "y" : 5
    }, {
      "x" : 16,
      "y" : 6
    }, {
      "x" : 3,
      "y" : 0
    }, {
      "x" : 14,
      "y" : 0
    }, {
      "x" : 11,
      "y" : 0
    }, {
      "x" : 1,
      "y" : 6
    }, {
      "x" : 10,
      "y" : 0
    }, {
      "x" : 0,
      "y" : 0
    }, {
      "x" : 8,
      "y" : 0
    }, {
      "x" : 14,
      "y" : 6
    }, {
      "x" : 6,
      "y" : 6
    } ]
  }
}