{
  "width" : 30,
  "height" : 40,
  "playableArea" : {
    "width" : 10,
    "height" : 20,
    "x" : 0,
    "y" : 0
  },
  "cells" : {
    "mover" : [ {
      "orientation" : "right",
      "x" : 1,
      "y" : 2
    } ],
    "generator" : [ {
      "orientation" : "left",
      "x" : 3,
      "y" : 4
    } ],
    "rotator" : [ {
      "rotation" : "clockwise",
      "x" : 5,
      "y" : 6
    } ],
    "block" : [ {
      "push" : "vertical",
      "x" : 7,
      "y" : 8
    } ],
    "enemy" : [ {
      "x" : 9,
      "y" : 10
    } ],
    "wall" : [ {
      "x" : 11,
      "y" : 12
    } ]
  }
}