{
  "width" : 10,
  "height" : 7,
  "playableArea" : {
    "width" : 8,
    "height" : 4,
    "x" : 0,
    "y" : 3
  },
  "cells" : {
    "mover" : [ {
      "orientation" : "left",
      "x" : 4,
      "y" : 4
    } ],
    "generator" : [ {
      "orientation" : "right",
      "x" : 0,
      "y" : 5
    } ],
    "rotator" : [ {
      "rotation" : "counterclockwise",
      "x" : 2,
      "y" : 4
    } ],
    "block" : [ {
      "push" : "both",
      "x" : 1,
      "y" : 3
    }, {
      "push" : "both",
      "x" : 3,
      "y" : 3
    }, {
      "push" : "horizontal",
      "x" : 4,
      "y" : 3
    } ],
    "enemy" : [ {
      "x" : 2,
      "y" : 1
    }, {
      "x" : 9,
      "y" : 5
    } ],
    "wall" : [ ]
  }
}