{
  "width" : 11,
  "height" : 13,
  "playableArea" : {
    "width" : 9,
    "height" : 5,
    "x" : 1,
    "y" : 1
  },
  "cells" : {
    "mover" : [ {
      "x" : 4,
      "y" : 2,
      "orientation" : "left"
    } ],
    "generator" : [ {
      "x" : 3,
      "y" : 4,
      "orientation" : "down"
    } ],
    "deleter" : [ {
      "x" : 10,
      "y" : 6
    }, {
      "x" : 0,
      "y" : 6
    } ],
    "rotator" : [ {
      "x" : 3,
      "y" : 1,
      "rotation" : "counterclockwise"
    }, {
      "x" : 7,
      "y" : 1,
      "rotation" : "clockwise"
    }, {
      "x" : 8,
      "y" : 1,
      "rotation" : "clockwise"
    }, {
      "x" : 2,
      "y" : 1,
      "rotation" : "counterclockwise"
    } ],
    "enemy" : [ {
      "x" : 3,
      "y" : 10
    }, {
      "x" : 3,
      "y" : 7
    }, {
      "x" : 3,
      "y" : 9
    }, {
      "x" : 7,
      "y" : 7
    }, {
      "x" : 7,
      "y" : 9
    }, {
      "x" : 7,
      "y" : 8
    }, {
      "x" : 7,
      "y" : 10
    }, {
      "x" : 3,
      "y" : 8
    } ],
    "wall" : [ {
      "x" : 10,
      "y" : 8
    }, {
      "x" : 3,
      "y" : 12
    }, {
      "x" : 1,
      "y" : 0
    }, {
      "x" : 5,
      "y" : 12
    }, {
      "x" : 0,
      "y" : 5
    }, {
      "x" : 10,
      "y" : 9
    }, {
      "x" : 5,
      "y" : 0
    }, {
      "x" : 1,
      "y" : 12
    }, {
      "x" : 10,
      "y" : 5
    }, {
      "x" : 10,
      "y" : 2
    }, {
      "x" : 2,
      "y" : 0
    }, {
      "x" : 7,
      "y" : 0
    }, {
      "x" : 10,
      "y" : 11
    }, {
      "x" : 4,
      "y" : 0
    }, {
      "x" : 0,
      "y" : 4
    }, {
      "x" : 0,
      "y" : 11
    }, {
      "x" : 0,
      "y" : 12
    }, {
      "x" : 10,
      "y" : 4
    }, {
      "x" : 6,
      "y" : 0
    }, {
      "x" : 7,
      "y" : 12
    }, {
      "x" : 2,
      "y" : 12
    }, {
      "x" : 0,
      "y" : 1
    }, {
      "x" : 10,
      "y" : 3
    }, {
      "x" : 0,
      "y" : 3
    }, {
      "x" : 4,
      "y" : 12
    }, {
      "x" : 9,
      "y" : 0
    }, {
      "x" : 8,
      "y" : 12
    }, {
      "x" : 0,
      "y" : 9
    }, {
      "x" : 0,
      "y" : 2
    }, {
      "x" : 0,
      "y" : 8
    }, {
      "x" : 9,
      "y" : 12
    }, {
      "x" : 10,
      "y" : 12
    }, {
      "x" : 0,
      "y" : 10
    }, {
      "x" : 0,
      "y" : 7
    }, {
      "x" : 10,
      "y" : 7
    }, {
      "x" : 3,
      "y" : 0
    }, {
      "x" : 10,
      "y" : 0
    }, {
      "x" : 10,
      "y" : 10
    }, {
      "x" : 6,
      "y" : 12
    }, {
      "x" : 0,
      "y" : 0
    }, {
      "x" : 8,
      "y" : 0
    }, {
      "x" : 10,
      "y" : 1
    } ]
  }
}