{
  "width" : 8,
  "height" : 16,
  "playableArea" : {
    "width" : 6,
    "height" : 5,
    "x" : 1,
    "y" : 7
  },
  "cells" : {
    "mover" : [ {
      "x" : 2,
      "y" : 7,
      "orientation" : "right"
    }, {
      "x" : 3,
      "y" : 8,
      "orientation" : "top"
    } ],
    "block" : [ {
      "x" : 3,
      "y" : 7,
      "push" : "both"
    } ],
    "rotator" : [ {
      "x" : 4,
      "y" : 5,
      "rotation" : "clockwise"
    }, {
      "x" : 3,
      "y" : 10,
      "rotation" : "clockwise"
    } ],
    "enemy" : [ {
      "x" : 4,
      "y" : 14
    }, {
      "x" : 3,
      "y" : 2
    }, {
      "x" : 4,
      "y" : 12
    }, {
      "x" : 4,
      "y" : 13
    } ],
    "wall" : [ {
      "x" : 7,
      "y" : 5
    }, {
      "x" : 4,
      "y" : 0
    }, {
      "x" : 3,
      "y" : 15
    }, {
      "x" : 7,
      "y" : 11
    }, {
      "x" : 7,
      "y" : 12
    }, {
      "x" : 7,
      "y" : 7
    }, {
      "x" : 4,
      "y" : 15
    }, {
      "x" : 7,
      "y" : 8
    }, {
      "x" : 5,
      "y" : 2
    }, {
      "x" : 7,
      "y" : 13
    }, {
      "x" : 7,
      "y" : 14
    }, {
      "x" : 0,
      "y" : 4
    }, {
      "x" : 0,
      "y" : 11
    }, {
      "x" : 0,
      "y" : 12
    }, {
      "x" : 1,
      "y" : 14
    }, {
      "x" : 0,
      "y" : 6
    }, {
      "x" : 5,
      "y" : 15
    }, {
      "x" : 0,
      "y" : 14
    }, {
      "x" : 6,
      "y" : 15
    }, {
      "x" : 0,
      "y" : 13
    }, {
      "x" : 0,
      "y" : 9
    }, {
      "x" : 1,
      "y" : 15
    }, {
      "x" : 2,
      "y" : 15
    }, {
      "x" : 0,
      "y" : 5
    }, {
      "x" : 6,
      "y" : 3
    }, {
      "x" : 7,
      "y" : 9
    }, {
      "x" : 7,
      "y" : 10
    }, {
      "x" : 7,
      "y" : 4
    }, {
      "x" : 5,
      "y" : 0
    }, {
      "x" : 0,
      "y" : 8
    }, {
      "x" : 4,
      "y" : 1
    }, {
      "x" : 1,
      "y" : 3
    }, {
      "x" : 0,
      "y" : 10
    }, {
      "x" : 0,
      "y" : 7
    }, {
      "x" : 7,
      "y" : 6
    }, {
      "x" : 3,
      "y" : 0
    }, {
      "x" : 2,
      "y" : 2
    }, {
      "x" : 3,
      "y" : 1
    }, {
      "x" : 6,
      "y" : 14
    }, {
      "x" : 2,
      "y" : 0
    } ]
  }
}