{
  "width": 15,
  "height": 7,
  "playableArea": {
    "width": 5,
    "height": 5,
    "x": 5,
    "y": 1
  },
  "cells": {
    "generator": [
      {
        "x": 7,
        "y": 2,
        "orientation": "right"
      },
      {
        "x": 8,
        "y": 5,
        "orientation": "left"
      }
    ],
    "block": [
      {
        "x": 5,
        "y": 3,
        "push": "vertical"
      }
    ],
    "enemy": [
      {
        "x": 12,
        "y": 3
      },
      {
        "x": 3,
        "y": 3
      }
    ],
    "wall": [
      {
        "x": 9,
        "y": 4
      },
      {
        "x": 0,
        "y": 0
      },
      {
        "x": 0,
        "y": 6
      },
      {
        "x": 1,
        "y": 0
      },
      {
        "x": 1,
        "y": 6
      },
      {
        "x": 2,
        "y": 0
      },
      {
        "x": 2,
        "y": 6
      },
      {
        "x": 3,
        "y": 0
      },
      {
        "x": 3,
        "y": 6
      },
      {
        "x": 4,
        "y": 0
      },
      {
        "x": 4,
        "y": 6
      },
      {
        "x": 5,
        "y": 0
      },
      {
        "x": 5,
        "y": 6
      },
      {
        "x": 6,
        "y": 0
      },
      {
        "x": 6,
        "y": 6
      },
      {
        "x": 7,
        "y": 0
      },
      {
        "x": 7,
        "y": 6
      },
      {
        "x": 8,
        "y": 0
      },
      {
        "x": 8,
        "y": 6
      },
      {
        "x": 9,
        "y": 0
      },
      {
        "x": 9,
        "y": 6
      },
      {
        "x": 10,
        "y": 0
      },
      {
        "x": 10,
        "y": 6
      },
      {
        "x": 11,
        "y": 0
      },
      {
        "x": 11,
        "y": 6
      },
      {
        "x": 12,
        "y": 0
      },
      {
        "x": 12,
        "y": 6
      },
      {
        "x": 13,
        "y": 0
      },
      {
        "x": 13,
        "y": 6
      },
      {
        "x": 14,
        "y": 0
      },
      {
        "x": 14,
        "y": 6
      },
      {
        "x": 0,
        "y": 1
      },
      {
        "x": 0,
        "y": 2
      },
      {
        "x": 0,
        "y": 3
      },
      {
        "x": 0,
        "y": 4
      },
      {
        "x": 0,
        "y": 5
      },
      {
        "x": 14,
        "y": 1
      },
      {
        "x": 14,
        "y": 2
      },
      {
        "x": 14,
        "y": 3
      },
      {
        "x": 14,
        "y": 4
      },
      {
        "x": 14,
        "y": 5
      }
    ]
  }
}