{
  "width" : 18,
  "height" : 14,
  "playableArea" : {
    "width" : 5,
    "height" : 5,
    "x" : 0,
    "y" : 0
  },
  "cells" : {
    "mover" : [ ],
    "generator" : [ {
      "orientation" : "right",
      "x" : 0,
      "y" : 0
    }, {
      "orientation" : "right",
      "x" : 1,
      "y" : 0
    }, {
      "orientation" : "down",
      "x" : 2,
      "y" : 0
    }, {
      "orientation" : "left",
      "x" : 4,
      "y" : 0
    } ],
    "rotator" : [ ],
    "block" : [ ],
    "enemy" : [ {
      "x" : 3,
      "y" : 10
    }, {
      "x" : 3,
      "y" : 12
    }, {
      "x" : 1,
      "y" : 13
    }, {
      "x" : 3,
      "y" : 11
    }, {
      "x" : 4,
      "y" : 11
    }, {
      "x" : 2,
      "y" : 12
    }, {
      "x" : 4,
      "y" : 12
    }, {
      "x" : 5,
      "y" : 12
    }, {
      "x" : 0,
      "y" : 13
    }, {
      "x" : 5,
      "y" : 10
    }, {
      "x" : 6,
      "y" : 11
    }, {
      "x" : 2,
      "y" : 13
    }, {
      "x" : 1,
      "y" : 10
    }, {
      "x" : 1,
      "y" : 12
    }, {
      "x" : 2,
      "y" : 10
    }, {
      "x" : 6,
      "y" : 12
    }, {
      "x" : 5,
      "y" : 13
    }, {
      "x" : 4,
      "y" : 10
    }, {
      "x" : 0,
      "y" : 11
    }, {
      "x" : 0,
      "y" : 12
    }, {
      "x" : 1,
      "y" : 11
    }, {
      "x" : 6,
      "y" : 13
    }, {
      "x" : 3,
      "y" : 13
    }, {
      "x" : 4,
      "y" : 13
    }, {
      "x" : 0,
      "y" : 10
    }, {
      "x" : 6,
      "y" : 10
    }, {
      "x" : 5,
      "y" : 11
    }, {
      "x" : 2,
      "y" : 11
    } ],
    "wall" : [ {
      "x" : 6,
      "y" : 7
    }, {
      "x" : 8,
      "y" : 6
    }, {
      "x" : 0,
      "y" : 9
    }, {
      "x" : 5,
      "y" : 8
    }, {
      "x" : 7,
      "y" : 6
    }, {
      "x" : 1,
      "y" : 6
    }, {
      "x" : 4,
      "y" : 7
    }, {
      "x" : 5,
      "y" : 9
    }, {
      "x" : 4,
      "y" : 6
    }, {
      "x" : 7,
      "y" : 5
    }, {
      "x" : 3,
      "y" : 7
    }, {
      "x" : 1,
      "y" : 7
    }, {
      "x" : 4,
      "y" : 5
    }, {
      "x" : 2,
      "y" : 8
    }, {
      "x" : 6,
      "y" : 9
    }, {
      "x" : 8,
      "y" : 8
    }, {
      "x" : 9,
      "y" : 8
    }, {
      "x" : 2,
      "y" : 5
    }, {
      "x" : 3,
      "y" : 9
    }, {
      "x" : 1,
      "y" : 8
    }, {
      "x" : 1,
      "y" : 5
    }, {
      "x" : 0,
      "y" : 6
    }, {
      "x" : 6,
      "y" : 8
    }, {
      "x" : 7,
      "y" : 7
    }, {
      "x" : 2,
      "y" : 6
    }, {
      "x" : 3,
      "y" : 6
    }, {
      "x" : 5,
      "y" : 6
    }, {
      "x" : 0,
      "y" : 5
    }, {
      "x" : 8,
      "y" : 9
    }, {
      "x" : 3,
      "y" : 5
    }, {
      "x" : 6,
      "y" : 5
    }, {
      "x" : 8,
      "y" : 5
    }, {
      "x" : 4,
      "y" : 9
    }, {
      "x" : 9,
      "y" : 6
    }, {
      "x" : 5,
      "y" : 5
    }, {
      "x" : 7,
      "y" : 9
    }, {
      "x" : 1,
      "y" : 9
    }, {
      "x" : 3,
      "y" : 8
    }, {
      "x" : 0,
      "y" : 8
    }, {
      "x" : 0,
      "y" : 7
    }, {
      "x" : 9,
      "y" : 9
    }, {
      "x" : 8,
      "y" : 7
    }, {
      "x" : 4,
      "y" : 8
    }, {
      "x" : 7,
      "y" : 8
    }, {
      "x" : 9,
      "y" : 7
    }, {
      "x" : 2,
      "y" : 7
    }, {
      "x" : 2,
      "y" : 9
    }, {
      "x" : 5,
      "y" : 7
    }, {
      "x" : 9,
      "y" : 5
    }, {
      "x" : 6,
      "y" : 6
    } ]
  }
}