{
  "width": 17,
  "height": 13,
  "playableArea": {
    "width": 9,
    "height": 4,
    "x": 7,
    "y": 8
  },
  "cells": {
    "mover": [
      {
        "x": 9,
        "y": 10,
        "orientation": "left"
      }
    ],
    "generator": [
      {
        "x": 7,
        "y": 10,
        "orientation": "top"
      }
    ],
    "block": [
      {
        "x": 10,
        "y": 11,
        "push": "both"
      },
      {
        "x": 7,
        "y": 8,
        "push": "both"
      },
      {
        "x": 10,
        "y": 10,
        "push": "both"
      },
      {
        "x": 13,
        "y": 9,
        "push": "both"
      },
      {
        "x": 8,
        "y": 11,
        "push": "both"
      },
      {
        "x": 14,
        "y": 10,
        "push": "both"
      },
      {
        "x": 12,
        "y": 11,
        "push": "both"
      }
    ],
    "enemy": [
      {
        "x": 3,
        "y": 10
      },
      {
        "x": 2,
        "y": 8
      },
      {
        "x": 8,
        "y": 2
      },
      {
        "x": 2,
        "y": 10
      }
    ],
    "wall": [
      {
        "x": 0,
        "y": 0
      },
      {
        "x": 0,
        "y": 12
      },
      {
        "x": 1,
        "y": 0
      },
      {
        "x": 1,
        "y": 12
      },
      {
        "x": 2,
        "y": 0
      },
      {
        "x": 2,
        "y": 12
      },
      {
        "x": 3,
        "y": 0
      },
      {
        "x": 3,
        "y": 12
      },
      {
        "x": 4,
        "y": 0
      },
      {
        "x": 4,
        "y": 12
      },
      {
        "x": 5,
        "y": 0
      },
      {
        "x": 5,
        "y": 12
      },
      {
        "x": 6,
        "y": 0
      },
      {
        "x": 6,
        "y": 12
      },
      {
        "x": 7,
        "y": 0
      },
      {
        "x": 7,
        "y": 12
      },
      {
        "x": 8,
        "y": 0
      },
      {
        "x": 8,
        "y": 12
      },
      {
        "x": 9,
        "y": 0
      },
      {
        "x": 9,
        "y": 12
      },
      {
        "x": 10,
        "y": 0
      },
      {
        "x": 10,
        "y": 12
      },
      {
        "x": 11,
        "y": 0
      },
      {
        "x": 11,
        "y": 12
      },
      {
        "x": 12,
        "y": 0
      },
      {
        "x": 12,
        "y": 12
      },
      {
        "x": 13,
        "y": 0
      },
      {
        "x": 13,
        "y": 12
      },
      {
        "x": 14,
        "y": 0
      },
      {
        "x": 14,
        "y": 12
      },
      {
        "x": 15,
        "y": 0
      },
      {
        "x": 15,
        "y": 12
      },
      {
        "x": 16,
        "y": 0
      },
      {
        "x": 16,
        "y": 12
      },
      {
        "x": 0,
        "y": 1
      },
      {
        "x": 0,
        "y": 2
      },
      {
        "x": 0,
        "y": 3
      },
      {
        "x": 0,
        "y": 4
      },
      {
        "x": 0,
        "y": 5
      },
      {
        "x": 0,
        "y": 6
      },
      {
        "x": 0,
        "y": 7
      },
      {
        "x": 0,
        "y": 8
      },
      {
        "x": 0,
        "y": 9
      },
      {
        "x": 0,
        "y": 10
      },
      {
        "x": 0,
        "y": 11
      },
      {
        "x": 16,
        "y": 1
      },
      {
        "x": 16,
        "y": 2
      },
      {
        "x": 16,
        "y": 3
      },
      {
        "x": 16,
        "y": 4
      },
      {
        "x": 16,
        "y": 5
      },
      {
        "x": 16,
        "y": 6
      },
      {
        "x": 16,
        "y": 7
      },
      {
        "x": 16,
        "y": 8
      },
      {
        "x": 16,
        "y": 9
      },
      {
        "x": 16,
        "y": 10
      },
      {
        "x": 16,
        "y": 11
      }
    ]
  }
}