{
  "width": 12,
  "height": 5,
  "playableArea": {
    "width": 4,
    "height": 3,
    "x": 1,
    "y": 1
  },
  "cells": {
    "generator": [
      {
        "x": 2,
        "y": 3,
        "orientation": "right"
      }
    ],
    "block": [
      {
        "x": 3,
        "y": 2,
        "push": "both"
      }
    ],
    "enemy": [
      {
        "x": 9,
        "y": 2
      },
      {
        "x": 8,
        "y": 2
      },
      {
        "x": 10,
        "y": 2
      }
    ],
    "wall": [
      {
        "x": 0,
        "y": 0
      },
      {
        "x": 0,
        "y": 4
      },
      {
        "x": 1,
        "y": 0
      },
      {
        "x": 1,
        "y": 4
      },
      {
        "x": 2,
        "y": 0
      },
      {
        "x": 2,
        "y": 4
      },
      {
        "x": 3,
        "y": 0
      },
      {
        "x": 3,
        "y": 4
      },
      {
        "x": 4,
        "y": 0
      },
      {
        "x": 4,
        "y": 4
      },
      {
        "x": 5,
        "y": 0
      },
      {
        "x": 5,
        "y": 4
      },
      {
        "x": 6,
        "y": 0
      },
      {
        "x": 6,
        "y": 4
      },
      {
        "x": 7,
        "y": 0
      },
      {
        "x": 7,
        "y": 4
      },
      {
        "x": 8,
        "y": 0
      },
      {
        "x": 8,
        "y": 4
      },
      {
        "x": 9,
        "y": 0
      },
      {
        "x": 9,
        "y": 4
      },
      {
        "x": 10,
        "y": 0
      },
      {
        "x": 10,
        "y": 4
      },
      {
        "x": 11,
        "y": 0
      },
      {
        "x": 11,
        "y": 4
      },
      {
        "x": 0,
        "y": 1
      },
      {
        "x": 0,
        "y": 2
      },
      {
        "x": 0,
        "y": 3
      },
      {
        "x": 11,
        "y": 1
      },
      {
        "x": 11,
        "y": 2
      },
      {
        "x": 11,
        "y": 3
      }
    ]
  }
}