{
  "width": 10,
  "height": 10,
  "playableArea": {
    "width": 20,
    "height": 30,
    "x": 1,
    "y": 2
  },
  "cells": {
    "mover": [
      {
        "orientation": "right",
        "x": 1,
        "y": 2
      },
      {
        "orientation": "top",
        "x": 0,
        "y": 0
      }
    ],
    "generator": [
      {
        "orientation": "right",
        "x": 1,
        "y": 2
      },
      {
        "orientation": "top",
        "x": 0,
        "y": 0
      }
    ]
  }
}