{
  "width": 20,
  "height": 14,
  "playableArea": {
    "width": 6,
    "height": 5,
    "x": 1,
    "y": 1
  },
  "cells": {
    "mover": [
      {
        "x": 5,
        "y": 1,
        "orientation": "right"
      },
      {
        "x": 2,
        "y": 4,
        "orientation": "right"
      },
      {
        "x": 3,
        "y": 1,
        "orientation": "down"
      }
    ],
    "generator": [
      {
        "x": 4,
        "y": 5,
        "orientation": "right"
      },
      {
        "x": 2,
        "y": 8,
        "orientation": "right"
      }
    ],
    "block": [
      {
        "x": 3,
        "y": 2,
        "push": "horizontal"
      },
      {
        "x": 1,
        "y": 8,
        "push": "horizontal"
      }
    ],
    "enemy": [
      {
        "x": 12,
        "y": 10
      },
      {
        "x": 13,
        "y": 10
      },
      {
        "x": 16,
        "y": 10
      },
      {
        "x": 15,
        "y": 10
      },
      {
        "x": 11,
        "y": 10
      },
      {
        "x": 14,
        "y": 10
      },
      {
        "x": 10,
        "y": 10
      },
      {
        "x": 17,
        "y": 10
      }
    ],
    "wall": [
      {
        "x": 0,
        "y": 0
      },
      {
        "x": 0,
        "y": 13
      },
      {
        "x": 1,
        "y": 0
      },
      {
        "x": 1,
        "y": 13
      },
      {
        "x": 2,
        "y": 0
      },
      {
        "x": 2,
        "y": 13
      },
      {
        "x": 3,
        "y": 0
      },
      {
        "x": 3,
        "y": 13
      },
      {
        "x": 4,
        "y": 0
      },
      {
        "x": 4,
        "y": 13
      },
      {
        "x": 5,
        "y": 0
      },
      {
        "x": 5,
        "y": 13
      },
      {
        "x": 6,
        "y": 0
      },
      {
        "x": 6,
        "y": 13
      },
      {
        "x": 7,
        "y": 0
      },
      {
        "x": 7,
        "y": 13
      },
      {
        "x": 8,
        "y": 0
      },
      {
        "x": 8,
        "y": 13
      },
      {
        "x": 9,
        "y": 0
      },
      {
        "x": 9,
        "y": 13
      },
      {
        "x": 10,
        "y": 0
      },
      {
        "x": 10,
        "y": 13
      },
      {
        "x": 11,
        "y": 0
      },
      {
        "x": 11,
        "y": 13
      },
      {
        "x": 12,
        "y": 0
      },
      {
        "x": 12,
        "y": 13
      },
      {
        "x": 13,
        "y": 0
      },
      {
        "x": 13,
        "y": 13
      },
      {
        "x": 14,
        "y": 0
      },
      {
        "x": 14,
        "y": 13
      },
      {
        "x": 15,
        "y": 0
      },
      {
        "x": 15,
        "y": 13
      },
      {
        "x": 16,
        "y": 0
      },
      {
        "x": 16,
        "y": 13
      },
      {
        "x": 17,
        "y": 0
      },
      {
        "x": 17,
        "y": 13
      },
      {
        "x": 18,
        "y": 0
      },
      {
        "x": 18,
        "y": 13
      },
      {
        "x": 19,
        "y": 0
      },
      {
        "x": 19,
        "y": 13
      },
      {
        "x": 0,
        "y": 1
      },
      {
        "x": 0,
        "y": 2
      },
      {
        "x": 0,
        "y": 3
      },
      {
        "x": 0,
        "y": 4
      },
      {
        "x": 0,
        "y": 5
      },
      {
        "x": 0,
        "y": 6
      },
      {
        "x": 0,
        "y": 7
      },
      {
        "x": 0,
        "y": 8
      },
      {
        "x": 0,
        "y": 9
      },
      {
        "x": 0,
        "y": 10
      },
      {
        "x": 0,
        "y": 11
      },
      {
        "x": 0,
        "y": 12
      },
      {
        "x": 19,
        "y": 1
      },
      {
        "x": 19,
        "y": 2
      },
      {
        "x": 19,
        "y": 3
      },
      {
        "x": 19,
        "y": 4
      },
      {
        "x": 19,
        "y": 5
      },
      {
        "x": 19,
        "y": 6
      },
      {
        "x": 19,
        "y": 7
      },
      {
        "x": 19,
        "y": 8
      },
      {
        "x": 19,
        "y": 9
      },
      {
        "x": 19,
        "y": 10
      },
      {
        "x": 19,
        "y": 11
      },
      {
        "x": 19,
        "y": 12
      }
    ]
  }
}